{
  "contractVersion": "1",
  "kind": "website-release-set",
  "members": [
    {
      "flavor": {
        "id": "grape",
        "revision": "r2"
      },
      "slug": "grape",
      "projection": {
        "path": "content/flavors/grape.json",
        "contentId": "sha256:e031aab601753eb4fa0d1060f68d586d362d0da59effc29184b3719355149620"
      }
    }
  ],
  "eligibilitySnapshot": {
    "id": "grape-web-eligibility",
    "revision": "r1",
    "contentId": "sha256:d92cf9f6a874b8c1aa0ed3ab7608a5931c39024046af5420396b3a9af7b0f99f"
  }
}
